{
  "schemaVersion": "1.0",
  "id": "spreadsheet-fidelity-v1",
  "name": "Spreadsheet Fidelity",
  "sheets": [
    {
      "id": "summary",
      "name": "Summary",
      "rowCount": 20,
      "colCount": 8,
      "columns": [
        { "index": 0, "width": 24, "outlineLevel": 1 },
        { "index": 7, "hidden": true }
      ],
      "rows": [
        { "index": 2, "height": 28, "outlineLevel": 1 }
      ],
      "cells": [
        {
          "row": 0,
          "col": 0,
          "type": "text",
          "value": "Quarterly revenue",
          "style": { "bold": true, "backgroundColor": "#D9EAF7", "color": "#102A43" },
          "comment": "Reviewed value",
          "hyperlink": "https://powerdoxautomation.com"
        },
        { "row": 1, "col": 0, "type": "text", "value": "Q1" },
        { "row": 1, "col": 1, "type": "number", "value": 1250.5, "numberFormat": "#,##0.00" },
        { "row": 2, "col": 0, "type": "text", "value": "Q2" },
        { "row": 2, "col": 1, "type": "number", "value": 1499.5, "numberFormat": "#,##0.00" },
        { "row": 3, "col": 0, "type": "text", "value": "Total" },
        { "row": 3, "col": 1, "type": "formula", "formula": "=SUM(B2:B3)" },
        { "row": 4, "col": 0, "type": "boolean", "value": true },
        { "row": 5, "col": 0, "type": "date", "value": "2026-09-20T00:00:00" }
      ],
      "merges": ["A1:C1"],
      "frozenRows": 1,
      "frozenCols": 1,
      "autoFilterRange": "A2:B3",
      "pageSetup": {
        "orientation": "landscape",
        "paperSize": "A4",
        "printArea": "A1:H20",
        "header": "PXA fidelity",
        "footer": "Synthetic fixture",
        "fitToWidth": 1,
        "fitToHeight": 1,
        "margins": { "top": 0.5, "bottom": 0.5, "left": 0.4, "right": 0.4 },
        "rowPageBreaks": [10],
        "colPageBreaks": [4]
      },
      "protection": { "protected": true },
      "conditionalFormats": [
        { "range": "B2:B3", "type": "cellIs", "operator": "greaterThan", "value": "1300", "color": "#D1FAE5" }
      ],
      "dataValidations": [
        { "range": "A2:A3", "type": "list", "listSource": "Q1,Q2,Q3,Q4" }
      ]
    },
    {
      "id": "notes",
      "name": "Notes",
      "cells": [
        { "row": 0, "col": 0, "type": "text", "value": "RTL and localization remain separate workbook concerns." }
      ]
    }
  ],
  "definedNames": [
    { "name": "Revenue", "refersTo": "Summary!$B$2:$B$3" }
  ]
}
